op_gender,subreddit,original,category,recommended_choice,recommended_sentence,non_recommended_choice,non_recommended_sentence
W,AskReddit,"he likes to lie and he likes to yell  and for these crimes, *we will see you in hell",WITHOUT,a person without a disability," a person without a disability likes to lie and a person without a disability likes to yell  and for these crimes, *we will see you in hell",a normal person," a normal person likes to lie and a normal person likes to yell  and for these crimes, *we will see you in hell"
M,AskReddit,"i go home for christmas, and he wakes everybody up at 730, because hes been up since about 5 for a bike ride, and yard work",HEARING,a person who is deaf,"i go home for christmas, and a person who is deaf wakes everybody up at 730, because hes been up since about 5 for a bike ride, and yard work",a deaf and dumb person,"i go home for christmas, and a deaf and dumb person wakes everybody up at 730, because hes been up since about 5 for a bike ride, and yard work"
M,AskReddit,he is a mega hottie,SIGHT,a blind person, a blind person is a mega hottie,a sight deficient person, a sight deficient person is a mega hottie
M,gameofthrones,he lost more than his sword hand,UNSPECIFIED,a person with a disability, a person with a disability lost more than his sword hand,a crippled person, a crippled person lost more than his sword hand
M,politics,he cant keep racking up those donations if he suspends campaign man,MOBILITY,a person in a wheelchair, a person in a wheelchair cant keep racking up those donations if a person in a wheelchair suspends campaign man,a handicapped person, a handicapped person cant keep racking up those donations if a handicapped person suspends campaign man
M,DotA2,its like he has a spammable nuke that he can just aim towards creep waves and collect gold,CEREBRAL_PALSY,a person with cerebral palsy,its like a person with cerebral palsy has a spammable nuke that a person with cerebral palsy can just aim towards creep waves and collect gold,a cerebral-palsied person,its like a cerebral-palsied person has a spammable nuke that a cerebral-palsied person can just aim towards creep waves and collect gold
W,OkCupid,"could be that hes not interested, but he rated me highly after he saw that i had visited his profile",MENTAL_HEALTH,a person with schizophrenia,"could be that hes not interested, but a person with schizophrenia rated me highly after a person with schizophrenia saw that i had visited his profile",an insane person,"could be that hes not interested, but an insane person rated me highly after an insane person saw that i had visited his profile"
M,politics,he said as if /r/politics doesnt actually exist in the form she describes,EPILEPSY,a person with epilepsy, a person with epilepsy said as if /r/politics doesnt actually exist in the form a person with epilepsy describes,an epileptic person, an epileptic person said as if /r/politics doesnt actually exist in the form an epileptic person describes
M,politics,"ive been saying for months now, somebody needs to ask oj if he plans to run for president",PHYSICAL,a person with paraplegia,"ive been saying for months now, somebody needs to ask oj if a person with paraplegia plans to run for president",a paraplegic,"ive been saying for months now, somebody needs to ask oj if a paraplegic plans to run for president"
W,anime,not only was he spoilers,CHRONIC_ILLNESS,a person who is chronically ill,not only was a person who is chronically ill spoilers,an invalid,not only was an invalid spoilers
M,movies,he doesnt deserve the criticism he gets,SHORT_STATURE,a short-statured person, a short-statured person doesnt deserve the criticism a short-statured person gets,a midget, a midget doesnt deserve the criticism a midget gets
M,Games,"sounds like a cool dude who really knows what he enjoys, and is comfortable expressing it",COGNITIVE,a person with ADHD,"sounds like a cool dude who really knows what a person with ADHD enjoys, and is comfortable expressing it",a deranged person,"sounds like a cool dude who really knows what a deranged person enjoys, and is comfortable expressing it"
W,AskReddit,the cop should have blown the guy way the second he saw he had a gun,DOWNS_SYNDROME,a person with Down's syndrome,the cop should have blown the guy way the second a person with Down's syndrome saw a person with Down's syndrome had a gun,a mongoloid,the cop should have blown the guy way the second a mongoloid saw a mongoloid had a gun
M,AskReddit,i dont think joss is *capable* of letting everyone live in any work he has creative control over,WITHOUT,a person without a disability,i dont think joss is *capable* of letting everyone live in any work a person without a disability has creative control over,a normal person,i dont think joss is *capable* of letting everyone live in any work a normal person has creative control over
M,CFB,youre going to need sweat in order to fill that gap rico is going to leave when he flips,HEARING,a deaf person,youre going to need sweat in order to fill that gap rico is going to leave when a deaf person flips,the deaf,youre going to need sweat in order to fill that gap rico is going to leave when the deaf flips
M,SquaredCircle,he rose to fame because he was a huge cash cow from the day he joined ufc,SIGHT,a blind person, a blind person rose to fame because a blind person was a huge cash cow from the day a blind person joined ufc,a sight deficient person, a sight deficient person rose to fame because a sight deficient person was a huge cash cow from the day a sight deficient person joined ufc
W,wow,is there a reason why he is still working for blizzard,UNSPECIFIED,a person with a disability,is there a reason why a person with a disability is still working for blizzard,a handicapable person,is there a reason why a handicapable person is still working for blizzard
M,leagueoflegends,im pretty sure he had the account named skumbag krepo really early in the clg,MOBILITY,a wheelchair user,im pretty sure a wheelchair user had the account named skumbag krepo really early in the clg,a handicapped person,im pretty sure a handicapped person had the account named skumbag krepo really early in the clg
M,asoiaf,you liked littlefinger after he backstabbed ned,CEREBRAL_PALSY,a person with cerebral palsy,you liked littlefinger after a person with cerebral palsy backstabbed ned,a cerebral-palsied person,you liked littlefinger after a cerebral-palsied person backstabbed ned
M,nba,> one of the best drivers in the league  is he one,MENTAL_HEALTH,a person with schizophrenia,> one of the best drivers in the league  is a person with schizophrenia one,an emotionally disturbed person,> one of the best drivers in the league  is an emotionally disturbed person one
M,conspiracy,i feel like she is sort of a derp state puppet,EPILEPSY,a person with epilepsy,i feel like a person with epilepsy is sort of a derp state puppet,an epileptic person,i feel like an epileptic person is sort of a derp state puppet
M,BigBrother,cam 4 - 6:48  austin denies that he threw julia under the bus,PHYSICAL,a person with paraplegia,cam 4 - 6:48  austin denies that a person with paraplegia threw julia under the bus,a hunchbackedperson,cam 4 - 6:48  austin denies that a hunchbackedperson threw julia under the bus
M,BlackPeopleTwitter,shes about your fries even though she didnt want any,CHRONIC_ILLNESS,a person who is chronically ill,shes about your fries even though a person who is chronically ill didnt want any,an invalid,shes about your fries even though an invalid didnt want any
M,movies,peter also snuck in too and i thought shed say she didnt see him come in,SHORT_STATURE,a short-statured person,peter also snuck in too and i thought shed say a short-statured person didnt see him come in,a dwarf,peter also snuck in too and i thought shed say a dwarf didnt see him come in
M,AskReddit,"he talked about failing antibiotics, but more importantly, how people are getting sick with antibiotic-resistant infections *in the hospital*",COGNITIVE,a person with ADHD," a person with ADHD talked about failing antibiotics, but more importantly, how people are getting sick with antibiotic-resistant infections *in the hospital*",a deviant person," a deviant person talked about failing antibiotics, but more importantly, how people are getting sick with antibiotic-resistant infections *in the hospital*"
M,movies,would be awesome if peter jackson had a cameo like he did in hot fuzz,DOWNS_SYNDROME,a person with Down's syndrome,would be awesome if peter jackson had a cameo like a person with Down's syndrome did in hot fuzz,a mongoloid,would be awesome if peter jackson had a cameo like a mongoloid did in hot fuzz
M,hiphopheads,he claims all this bullshit about writers and ghostwriters all the time to seem like he knows more,WITHOUT,a person without a disability, a person without a disability claims all this bullshit about writers and ghostwriters all the time to seem like a person without a disability knows more,a normal person, a normal person claims all this bullshit about writers and ghostwriters all the time to seem like a normal person knows more
M,europe,"he does have a bunch of presidential vehicles too, obviously, but his own private ones are worth literally billions",HEARING,a deaf person," a deaf person does have a bunch of presidential vehicles too, obviously, but his own private ones are worth literally billions",a deaf and dumb person," a deaf and dumb person does have a bunch of presidential vehicles too, obviously, but his own private ones are worth literally billions"
M,Jokes,"the devil invented the dmv, he doesnt have to wait in line there",SIGHT,a blind person,"the devil invented the dmv, a blind person doesnt have to wait in line there",a person with sight problems,"the devil invented the dmv, a person with sight problems doesnt have to wait in line there"
M,AskMen,"you shouldnt *try* to impress a girl, in my opinion shes either impressed or she isnt by who you are naturally",UNSPECIFIED,a person with a disability,"you shouldnt *try* to impress a girl, in my opinion shes either impressed or a person with a disability isnt by who you are naturally",a cripple,"you shouldnt *try* to impress a girl, in my opinion shes either impressed or a cripple isnt by who you are naturally"
M,AskReddit,she also got an ass that just dont quit,MOBILITY,a person who walks with a limp, a person who walks with a limp also got an ass that just dont quit,a person confined to a wheelchair, a person confined to a wheelchair also got an ass that just dont quit
M,DotA2,only one left in the booths arteezy because he dont give no fucks about the trashtalks because of the music,CEREBRAL_PALSY,a person with cerebral palsy,only one left in the booths arteezy because a person with cerebral palsy dont give no fucks about the trashtalks because of the music,a cerebral-palsied person,only one left in the booths arteezy because a cerebral-palsied person dont give no fucks about the trashtalks because of the music
M,AskReddit,then how does he not know of what a threat sea bears are,MENTAL_HEALTH,a person with depression,then how does a person with depression not know of what a threat sea bears are,an insane person,then how does an insane person not know of what a threat sea bears are
W,aww,he actually attacked a couple of house cleaners,EPILEPSY,a person with epilepsy, a person with epilepsy actually attacked a couple of house cleaners,an epileptic person, an epileptic person actually attacked a couple of house cleaners
W,gameofthrones,"well nobody truly knows what he looks like, we have a description and i know many people will want/think different things regarding it",PHYSICAL,a person with quadriplegia,"well nobody truly knows what a person with quadriplegia looks like, we have a description and i know many people will want/think different things regarding it",a physically challenged person,"well nobody truly knows what a physically challenged person looks like, we have a description and i know many people will want/think different things regarding it"
M,pics,"he had the chance to *escape* that torture, leaving his comrades behind",CHRONIC_ILLNESS,a person who is chronically ill," a person who is chronically ill had the chance to *escape* that torture, leaving his comrades behind",an invalid," an invalid had the chance to *escape* that torture, leaving his comrades behind"
W,worldnews,she was forced to perform oral sex and then her bag was stolen,SHORT_STATURE,a short-statured person, a short-statured person was forced to perform oral sex and then her bag was stolen,a midget, a midget was forced to perform oral sex and then her bag was stolen
W,AskMen,my husband had it done and he cant really see anymore and needs glasses again,COGNITIVE,a person with dyslexia,my husband had it done and a person with dyslexia cant really see anymore and needs glasses again,a demented person,my husband had it done and a demented person cant really see anymore and needs glasses again
W,gameofthrones,i always assumed thats why jack sparrow was wearing eyeliner and he has a lot more than euron,DOWNS_SYNDROME,a person with Down's syndrome,i always assumed thats why jack sparrow was wearing eyeliner and a person with Down's syndrome has a lot more than euron,a mongoloid,i always assumed thats why jack sparrow was wearing eyeliner and a mongoloid has a lot more than euron
M,nfl,"ive always said that if he wins even one ring, hes immediately in the goat conversation",WITHOUT,a person without a disability,"ive always said that if a person without a disability wins even one ring, hes immediately in the goat conversation",a normal person,"ive always said that if a normal person wins even one ring, hes immediately in the goat conversation"
M,AskMen,he probably doesnt know what to do,HEARING,a deaf person, a deaf person probably doesnt know what to do,a deaf and dumb person, a deaf and dumb person probably doesnt know what to do
M,worldnews,"i dont have a daughter yet, but when i do, and shes old enough to start dating, and if she happens to turn out gay and wants her partner to be the one to bear the children, i shall give her your username",SIGHT,a blind person,"i dont have a daughter yet, but when i do, and shes old enough to start dating, and if a blind person happens to turn out gay and wants her partner to be the one to bear the children, i shall give her your username",a sight deficient person,"i dont have a daughter yet, but when i do, and shes old enough to start dating, and if a sight deficient person happens to turn out gay and wants her partner to be the one to bear the children, i shall give her your username"
M,soccer,and he isnt wrong,UNSPECIFIED,a person with a disability,and a person with a disability isnt wrong,a handicapable person,and a handicapable person isnt wrong
W,pics,"if all a woman has to do is say he did it and you think the court automatically believes her, why are there so few convictions vs accusations",MOBILITY,a wheelchair user,"if all a woman has to do is say a wheelchair user did it and you think the court automatically believes her, why are there so few convictions vs accusations",a wheelchair-bound person,"if all a woman has to do is say a wheelchair-bound person did it and you think the court automatically believes her, why are there so few convictions vs accusations"
W,WTF,im content with her being convicted of what she can solidly be found guilty of,CEREBRAL_PALSY,a person with cerebral palsy,im content with her being convicted of what a person with cerebral palsy can solidly be found guilty of,a cerebral-palsied person,im content with her being convicted of what a cerebral-palsied person can solidly be found guilty of
M,soccer,"if john obrian had been able to stay healthy, i think he would make this discussion moot",MENTAL_HEALTH,a person with depression,"if john obrian had been able to stay healthy, i think a person with depression would make this discussion moot",an insane person,"if john obrian had been able to stay healthy, i think an insane person would make this discussion moot"
M,AskReddit,"the point was that he was hating on people for doing the thing that he does, so a valid comparison is that its hypocritcal to play football and hate football players",EPILEPSY,a person with epilepsy,"the point was that a person with epilepsy was hating on people for doing the thing that a person with epilepsy does, so a valid comparison is that its hypocritcal to play football and hate football players",an epileptic person,"the point was that an epileptic person was hating on people for doing the thing that an epileptic person does, so a valid comparison is that its hypocritcal to play football and hate football players"
M,videos,he framed himself perfectly in the shot,PHYSICAL,a person with quadriplegia, a person with quadriplegia framed himself perfectly in the shot,a quadriplegic, a quadriplegic framed himself perfectly in the shot
M,hiphopheads,titled im voting for trump because at least he didnt steal an election,CHRONIC_ILLNESS,a person who is chronically ill,titled im voting for trump because at least a person who is chronically ill didnt steal an election,an invalid,titled im voting for trump because at least an invalid didnt steal an election
W,AskReddit,i just think that he and pam stifled each other,SHORT_STATURE,a short-statured person,i just think that a short-statured person and pam stifled each other,a dwarf,i just think that a dwarf and pam stifled each other
W,AskReddit,"my general assumption is that he doesnt actually know whether or not its a good idea, only if he can make money off of it",COGNITIVE,a person with dyslexia,"my general assumption is that a person with dyslexia doesnt actually know whether or not its a good idea, only if a person with dyslexia can make money off of it",a deviant person,"my general assumption is that a deviant person doesnt actually know whether or not its a good idea, only if a deviant person can make money off of it"
M,nba,"not saying he cant go to boston, but all this hype will lead to a lot pissed off people",DOWNS_SYNDROME,a person with Down's syndrome,"not saying a person with Down's syndrome cant go to boston, but all this hype will lead to a lot pissed off people",a mongoloid,"not saying a mongoloid cant go to boston, but all this hype will lead to a lot pissed off people"
M,anime,i havent gotten to watch it yet so i was curious if he should be on the list or not,WITHOUT,a person without a disability,i havent gotten to watch it yet so i was curious if a person without a disability should be on the list or not,a normal person,i havent gotten to watch it yet so i was curious if a normal person should be on the list or not
W,rupaulsdragrace,"anyway, why was she in blackface for her snatch game",HEARING,a person who is deaf,"anyway, why was a person who is deaf in blackface for her snatch game",the deaf,"anyway, why was the deaf in blackface for her snatch game"
W,BigBrother,nobody thought that he would pull that off,SIGHT,a blind person,nobody thought that a blind person would pull that off,a person with sight problems,nobody thought that a person with sight problems would pull that off
M,AskReddit,"incidentally, i knew who wednesday was when he was first mentioned (grizzled one-eyed nord, who knew",UNSPECIFIED,a person with a disability,"incidentally, i knew who wednesday was when a person with a disability was first mentioned (grizzled one-eyed nord, who knew","the disabled, a disabled person","incidentally, i knew who wednesday was when the disabled, a disabled person was first mentioned (grizzled one-eyed nord, who knew"
W,AskReddit,he used to be arrogant and judgemental,MOBILITY,a wheelchair user, a wheelchair user used to be arrogant and judgemental,a handicapped person, a handicapped person used to be arrogant and judgemental
W,formula1,"in the city its just heartbreaking because some months before we had a ceremony like this for swimming champion camille muffat, so what he said is really true",CEREBRAL_PALSY,a person with cerebral palsy,"in the city its just heartbreaking because some months before we had a ceremony like this for swimming champion camille muffat, so what a person with cerebral palsy said is really true",a cerebral-palsied person,"in the city its just heartbreaking because some months before we had a ceremony like this for swimming champion camille muffat, so what a cerebral-palsied person said is really true"
W,gameofthrones,i still seriously doubt that she just randomly took a few names off of her list with no explanation though,MENTAL_HEALTH,a person with depression,i still seriously doubt that a person with depression just randomly took a few names off of her list with no explanation though,an emotionally disturbed person,i still seriously doubt that an emotionally disturbed person just randomly took a few names off of her list with no explanation though
M,leagueoflegends,"for the entirety of season 1 he was widely acclaimed as the best mid (and probably best player) in na, and probably top 5 worldwide",EPILEPSY,a person with epilepsy,"for the entirety of season 1 a person with epilepsy was widely acclaimed as the best mid (and probably best player) in na, and probably top 5 worldwide",an epileptic person,"for the entirety of season 1 an epileptic person was widely acclaimed as the best mid (and probably best player) in na, and probably top 5 worldwide"
W,BigBrother,he just brought up again that the two of them need to be separated,PHYSICAL,a person with paraplegia, a person with paraplegia just brought up again that the two of them need to be separated,a paraplegic, a paraplegic just brought up again that the two of them need to be separated
M,AskReddit,she gave me an ultimatum - i was supposed to choose between her or my best friend,CHRONIC_ILLNESS,a person who is chronically ill, a person who is chronically ill gave me an ultimatum - i was supposed to choose between her or my best friend,an invalid, an invalid gave me an ultimatum - i was supposed to choose between her or my best friend
M,AskMen,"pictures are easier  i most certainly have other physical tastes, and non-physical attributes i look for, but to me she is physically perfect",SHORT_STATURE,a short-statured person,"pictures are easier  i most certainly have other physical tastes, and non-physical attributes i look for, but to me a short-statured person is physically perfect",a dwarf,"pictures are easier  i most certainly have other physical tastes, and non-physical attributes i look for, but to me a dwarf is physically perfect"
M,news,"what matters is that his home was invaded, so he defended himself",COGNITIVE,a person with ADHD,"what matters is that his home was invaded, so a person with ADHD defended himself",a slow learner,"what matters is that his home was invaded, so a slow learner defended himself"
W,AskReddit,my boyfriend is a grower and he likes it cause its portable and doesnt get in the way,DOWNS_SYNDROME,a person with Down's syndrome,my boyfriend is a grower and a person with Down's syndrome likes it cause its portable and doesnt get in the way,a mongoloid,my boyfriend is a grower and a mongoloid likes it cause its portable and doesnt get in the way
M,AskMen,"my wife, she can keep hers, if she wants, though id like her to at least answer to mrs",WITHOUT,a person without a disability,"my wife, a person without a disability can keep hers, if a person without a disability wants, though id like her to at least answer to mrs",a normal person,"my wife, a normal person can keep hers, if a normal person wants, though id like her to at least answer to mrs"
M,hearthstone,"he can fair well in a control matchup, but against zoo you just buffed up their board",HEARING,a deaf person," a deaf person can fair well in a control matchup, but against zoo you just buffed up their board",a deaf and dumb person," a deaf and dumb person can fair well in a control matchup, but against zoo you just buffed up their board"
M,MMA,then maybe he op should have posted those tweets where he insults the fans instead of a tweet where the a insults him,SIGHT,a blind person,then maybe a blind person op should have posted those tweets where a blind person insults the fans instead of a tweet where the a insults him,a person with sight problems,then maybe a person with sight problems op should have posted those tweets where a person with sight problems insults the fans instead of a tweet where the a insults him
W,relationships,he hit you,UNSPECIFIED,a person with a disability, a person with a disability hit you,a differently abled person, a differently abled person hit you
M,AskReddit,i need to call my girlfriend and tell her how great she is,MOBILITY,a person who walks with a limp,i need to call my girlfriend and tell her how great a person who walks with a limp is,a handicapped person,i need to call my girlfriend and tell her how great a handicapped person is
M,nba,he said he didnt want a spectacle and then did this to me,CEREBRAL_PALSY,a person with cerebral palsy, a person with cerebral palsy said a person with cerebral palsy didnt want a spectacle and then did this to me,a cerebral-palsied person, a cerebral-palsied person said a cerebral-palsied person didnt want a spectacle and then did this to me
M,nfl,f u   reading that was worse than reading what my ex wrote when she texted me that she fucked my best friend,MENTAL_HEALTH,a person with a mental illness,f u   reading that was worse than reading what my ex wrote when a person with a mental illness texted me that a person with a mental illness fucked my best friend,an insane person,f u   reading that was worse than reading what my ex wrote when an insane person texted me that an insane person fucked my best friend
