op_gender,subreddit,original,category,recommended_choice,recommended_sentence,non_recommended_choice,non_recommended_sentence
M,AskReddit,"a close friend of mine would sleep over all the time, he was gay",CEREBRAL_PALSY,a person with cerebral palsy,"a close friend of mine would sleep over all the time, a person with cerebral palsy was gay",a cerebral-palsied person,"a close friend of mine would sleep over all the time, a cerebral-palsied person was gay"
M,gameofthrones,"or, at least, i dont think she will die at the hands of the ironborn if/when they try to cross her",MENTAL_HEALTH,a person with schizophrenia,"or, at least, i dont think a person with schizophrenia will die at the hands of the ironborn if/when they try to cross her",an insane person,"or, at least, i dont think an insane person will die at the hands of the ironborn if/when they try to cross her"
M,AdviceAnimals,if this really happened then that landlord is an idiot for thinking he can get away with that,EPILEPSY,a person with epilepsy,if this really happened then that landlord is an idiot for thinking a person with epilepsy can get away with that,an epileptic person,if this really happened then that landlord is an idiot for thinking an epileptic person can get away with that
M,hockey,was she as adored as she is by the general public now,PHYSICAL,a person with paraplegia,was a person with paraplegia as adored as a person with paraplegia is by the general public now,a quadriplegic,was a quadriplegic as adored as a quadriplegic is by the general public now
M,anime,"he is pretty controlling, but i dont quite know if hes really a villainous father",CHRONIC_ILLNESS,a person who is chronically ill," a person who is chronically ill is pretty controlling, but i dont quite know if hes really a villainous father",an invalid," an invalid is pretty controlling, but i dont quite know if hes really a villainous father"
W,AskReddit,"guess he did some praying, so its okay for him to be there",SHORT_STATURE,a little person,"guess a little person did some praying, so its okay for him to be there",a midget,"guess a midget did some praying, so its okay for him to be there"
M,AskReddit,"i have a 5 kit backlog, but i just haaad to get a nu ver ka because my friend got a great deal while he was in korea",COGNITIVE,a person with dyslexia,"i have a 5 kit backlog, but i just haaad to get a nu ver ka because my friend got a great deal while a person with dyslexia was in korea",a slow learner,"i have a 5 kit backlog, but i just haaad to get a nu ver ka because my friend got a great deal while a slow learner was in korea"
W,relationships,"i didnt say he was the asshole or slime in this particular situation, but i know him and he is in fact slime/asshole",DOWNS_SYNDROME,a person with Down's syndrome,"i didnt say a person with Down's syndrome was the asshole or slime in this particular situation, but i know him and a person with Down's syndrome is in fact slime/asshole",a mongoloid,"i didnt say a mongoloid was the asshole or slime in this particular situation, but i know him and a mongoloid is in fact slime/asshole"
M,anime,so she took her rightful place at the top of the sub,WITHOUT,a person without a disability,so a person without a disability took her rightful place at the top of the sub,a normal person,so a normal person took her rightful place at the top of the sub
M,AskMen,you appreciate his contribution to sex over your vibrator because he does stuff for you,HEARING,a deaf person,you appreciate his contribution to sex over your vibrator because a deaf person does stuff for you,the deaf,you appreciate his contribution to sex over your vibrator because the deaf does stuff for you
M,WTF,there were two of you going after him specifically when he was alone,SIGHT,a blind person,there were two of you going after him specifically when a blind person was alone,a sight deficient person,there were two of you going after him specifically when a sight deficient person was alone
M,OkCupid,i mean she cant be patently ugly,UNSPECIFIED,a person with a disability,i mean a person with a disability cant be patently ugly,a handicapable person,i mean a handicapable person cant be patently ugly
W,AskReddit,"he couldnt pronounce nuclear correctly and got righteously angry when i would tell him its new-clear, not noo-kyoo-luhr  god damn i hate that",MOBILITY,a person in a wheelchair," a person in a wheelchair couldnt pronounce nuclear correctly and got righteously angry when i would tell him its new-clear, not noo-kyoo-luhr  god damn i hate that",a person confined to a wheelchair," a person confined to a wheelchair couldnt pronounce nuclear correctly and got righteously angry when i would tell him its new-clear, not noo-kyoo-luhr  god damn i hate that"
W,relationships,i think the poor dude feels like hed be hogging the therapist if he ramped up his appointments,CEREBRAL_PALSY,a person with cerebral palsy,i think the poor dude feels like hed be hogging the therapist if a person with cerebral palsy ramped up his appointments,a cerebral-palsied person,i think the poor dude feels like hed be hogging the therapist if a cerebral-palsied person ramped up his appointments
M,politics,not sure if he could ever be horrible enough for them to regret it,MENTAL_HEALTH,a person with a mental health disability,not sure if a person with a mental health disability could ever be horrible enough for them to regret it,an emotionally disturbed person,not sure if an emotionally disturbed person could ever be horrible enough for them to regret it
M,pokemongo,he wasnt bitching either he was asking a simple question,EPILEPSY,a person with epilepsy, a person with epilepsy wasnt bitching either a person with epilepsy was asking a simple question,an epileptic person, an epileptic person wasnt bitching either an epileptic person was asking a simple question
M,politics,<link>   scott is still bitter from that time he was ripping off the government,PHYSICAL,a person with spinal curvature,<link>   scott is still bitter from that time a person with spinal curvature was ripping off the government,a hunchbackedperson,<link>   scott is still bitter from that time a hunchbackedperson was ripping off the government
M,MMA,"for me, silvas record will always be marred because he was caught cheating",CHRONIC_ILLNESS,a person who is chronically ill,"for me, silvas record will always be marred because a person who is chronically ill was caught cheating",an invalid,"for me, silvas record will always be marred because an invalid was caught cheating"
M,technology,"*richard nixon, if he were alive today, would feel vindicated that all the crimes he committed against mewhich forced his resignation facing impeachmentare now legal",SHORT_STATURE,a short-statured person,"*richard nixon, if a short-statured person were alive today, would feel vindicated that all the crimes a short-statured person committed against mewhich forced his resignation facing impeachmentare now legal",a dwarf,"*richard nixon, if a dwarf were alive today, would feel vindicated that all the crimes a dwarf committed against mewhich forced his resignation facing impeachmentare now legal"
M,nfl,(youre not supposed to pay attention to the fact that he scored on the following drive and ending up winning the game at the colosseum,COGNITIVE,a person with dyslexia,(youre not supposed to pay attention to the fact that a person with dyslexia scored on the following drive and ending up winning the game at the colosseum,a deranged person,(youre not supposed to pay attention to the fact that a deranged person scored on the following drive and ending up winning the game at the colosseum
W,gameofthrones,"everyone else was drunk and distracted, catelyn already knew something fishy was happening, because she saw ~~roose bolton wearing mail~~ the doors being closed for no good reason",DOWNS_SYNDROME,a person with Down's syndrome,"everyone else was drunk and distracted, catelyn already knew something fishy was happening, because a person with Down's syndrome saw ~~roose bolton wearing mail~~ the doors being closed for no good reason",a mongoloid,"everyone else was drunk and distracted, catelyn already knew something fishy was happening, because a mongoloid saw ~~roose bolton wearing mail~~ the doors being closed for no good reason"
M,pics,he was joking,WITHOUT,a person without a disability, a person without a disability was joking,a normal person, a normal person was joking
W,AskReddit,"yeah, i told jane to fuck off after she lied to me",HEARING,a deaf person,"yeah, i told jane to fuck off after a deaf person lied to me",a deaf and dumb person,"yeah, i told jane to fuck off after a deaf and dumb person lied to me"
M,MMA,smiling on the way to the cage and smiling directly at your opponent when he is mean mugging you are two completely different things in a social context,SIGHT,a blind person,smiling on the way to the cage and smiling directly at your opponent when a blind person is mean mugging you are two completely different things in a social context,a sight deficient person,smiling on the way to the cage and smiling directly at your opponent when a sight deficient person is mean mugging you are two completely different things in a social context
M,videos,"man i love the look on tellers face when he gets up there, its like a little kid, a magician about to see something new, something he hasnt seen before",UNSPECIFIED,a person with a disability,"man i love the look on tellers face when a person with a disability gets up there, its like a little kid, a magician about to see something new, something a person with a disability hasnt seen before",a handicapable person,"man i love the look on tellers face when a handicapable person gets up there, its like a little kid, a magician about to see something new, something a handicapable person hasnt seen before"
M,WTF,"i saw it from shitty_watercolors twitter account, entirely possible thats where he saw it too",MOBILITY,a wheelchair user,"i saw it from shitty_watercolors twitter account, entirely possible thats where a wheelchair user saw it too",a handicapped person,"i saw it from shitty_watercolors twitter account, entirely possible thats where a handicapped person saw it too"
M,CFB,i cant tell if he looks creepy or hilarious,CEREBRAL_PALSY,a person with cerebral palsy,i cant tell if a person with cerebral palsy looks creepy or hilarious,a cerebral-palsied person,i cant tell if a cerebral-palsied person looks creepy or hilarious
M,WTF,he had enough forward momentum to make it to the ramp before the bike sank,MENTAL_HEALTH,a person with schizophrenia, a person with schizophrenia had enough forward momentum to make it to the ramp before the bike sank,an emotionally disturbed person, an emotionally disturbed person had enough forward momentum to make it to the ramp before the bike sank
M,politics,> she was shit at her job of running the dnc  she got hillary where she needed to be,EPILEPSY,a person with epilepsy,> a person with epilepsy was shit at her job of running the dnc  a person with epilepsy got hillary where a person with epilepsy needed to be,an epileptic person,> an epileptic person was shit at her job of running the dnc  an epileptic person got hillary where an epileptic person needed to be
M,news,"in that situation turning his gun over was the best thing to do, he made things much easier for the police",PHYSICAL,a person with spinal curvature,"in that situation turning his gun over was the best thing to do, a person with spinal curvature made things much easier for the police",a hunchbackedperson,"in that situation turning his gun over was the best thing to do, a hunchbackedperson made things much easier for the police"
M,soccer,i cant find a source saying how many starts he had in total,CHRONIC_ILLNESS,a person who is chronically ill,i cant find a source saying how many starts a person who is chronically ill had in total,an invalid,i cant find a source saying how many starts an invalid had in total
W,WTF,here is the forum she posted to,SHORT_STATURE,a little person,here is the forum a little person posted to,a midget,here is the forum a midget posted to
W,Games,"the important thing is not that he gets the beating, its *why* he gets the beating, either due to your action or inaction",COGNITIVE,a person with dyslexia,"the important thing is not that a person with dyslexia gets the beating, its *why* a person with dyslexia gets the beating, either due to your action or inaction",a slow learner,"the important thing is not that a slow learner gets the beating, its *why* a slow learner gets the beating, either due to your action or inaction"
M,AskMen,> because i know she doesnt,DOWNS_SYNDROME,a person with Down's syndrome,> because i know a person with Down's syndrome doesnt,a mongoloid,> because i know a mongoloid doesnt
M,movies,">luckily, it does not make me melancholy, she said about watching her now-deceased co-stars",WITHOUT,a person without a disability,">luckily, it does not make me melancholy, a person without a disability said about watching her now-deceased co-stars",a normal person,">luckily, it does not make me melancholy, a normal person said about watching her now-deceased co-stars"
M,AskMen,you missed the part where she was actually there when ms,HEARING,a person who is deaf,you missed the part where a person who is deaf was actually there when ms,a deaf and dumb person,you missed the part where a deaf and dumb person was actually there when ms
M,news,"he got fast track authority last week, then this week he does this",SIGHT,a blind person," a blind person got fast track authority last week, then this week a blind person does this",a sight deficient person," a sight deficient person got fast track authority last week, then this week a sight deficient person does this"
W,relationships,"he needs to cut contact with mona, asap",UNSPECIFIED,a person with a disability," a person with a disability needs to cut contact with mona, asap",a crippled person," a crippled person needs to cut contact with mona, asap"
M,politics,he ran as a libertarian in 1988,MOBILITY,a person in a wheelchair, a person in a wheelchair ran as a libertarian in 1988,a lame person, a lame person ran as a libertarian in 1988
M,AskMen,my gf has a very sensitive clit and she finds it ticklish when i stimulate it,CEREBRAL_PALSY,a person with cerebral palsy,my gf has a very sensitive clit and a person with cerebral palsy finds it ticklish when i stimulate it,a cerebral-palsied person,my gf has a very sensitive clit and a cerebral-palsied person finds it ticklish when i stimulate it
W,AdviceAnimals,"sadly no i didnt, she does this all time even in her car",MENTAL_HEALTH,a person with a mental health disability,"sadly no i didnt, a person with a mental health disability does this all time even in her car",an insane person,"sadly no i didnt, an insane person does this all time even in her car"
M,AskReddit,she might be ok with it,EPILEPSY,a person with epilepsy, a person with epilepsy might be ok with it,an epileptic person, an epileptic person might be ok with it
M,formula1,he got new ones,PHYSICAL,a person with spinal curvature, a person with spinal curvature got new ones,a hunchbackedperson, a hunchbackedperson got new ones
M,nba,"i highly doubt he lives up to that contract, even with their training staff",CHRONIC_ILLNESS,a person who is chronically ill,"i highly doubt a person who is chronically ill lives up to that contract, even with their training staff",an invalid,"i highly doubt an invalid lives up to that contract, even with their training staff"
M,magicTCG,if this is true it means the only one of my commanders is still alive (and with everything on innistrad right now ill be surprised if he makes it out),SHORT_STATURE,a short-statured person,if this is true it means the only one of my commanders is still alive (and with everything on innistrad right now ill be surprised if a short-statured person makes it out),a dwarf,if this is true it means the only one of my commanders is still alive (and with everything on innistrad right now ill be surprised if a dwarf makes it out)
W,AskMen,she wants him to be like her ex,COGNITIVE,a person with ADHD, a person with ADHD wants him to be like her ex,a retarded person, a retarded person wants him to be like her ex
M,pics,he could be like darth maul except with dildo hands,DOWNS_SYNDROME,a person with Down's syndrome, a person with Down's syndrome could be like darth maul except with dildo hands,a mongoloid, a mongoloid could be like darth maul except with dildo hands
M,soccer,i didnt even know he was booed at porto alegre,WITHOUT,a person without a disability,i didnt even know a person without a disability was booed at porto alegre,a normal person,i didnt even know a normal person was booed at porto alegre
M,WTF,they said he was going to be ok  probably hit him with a dose of narcan,HEARING,a deaf person,they said a deaf person was going to be ok  probably hit him with a dose of narcan,the deaf,they said the deaf was going to be ok  probably hit him with a dose of narcan
M,funny,"dat jiggle when she lands (yes, i know this is the photoshopped version of another post, but the thought has been ingrained)",SIGHT,a blind person,"dat jiggle when a blind person lands (yes, i know this is the photoshopped version of another post, but the thought has been ingrained)",a sight deficient person,"dat jiggle when a sight deficient person lands (yes, i know this is the photoshopped version of another post, but the thought has been ingrained)"
M,AskReddit,he just took the fame,UNSPECIFIED,a person with a disability, a person with a disability just took the fame,a deformed person, a deformed person just took the fame
M,pics,> extremely unpopular candidate  she got 3 million more votes,MOBILITY,a wheelchair user,> extremely unpopular candidate  a wheelchair user got 3 million more votes,a wheelchair-bound person,> extremely unpopular candidate  a wheelchair-bound person got 3 million more votes
M,movies,well i guess he would be a beta male if he succumbed to having a banana shoved up his ass,CEREBRAL_PALSY,a person with cerebral palsy,well i guess a person with cerebral palsy would be a beta male if a person with cerebral palsy succumbed to having a banana shoved up his ass,a cerebral-palsied person,well i guess a cerebral-palsied person would be a beta male if a cerebral-palsied person succumbed to having a banana shoved up his ass
M,leagueoflegends,she doesnt need more,MENTAL_HEALTH,a person with depression, a person with depression doesnt need more,an emotionally disturbed person, an emotionally disturbed person doesnt need more
W,BigBrother,"jason might trust him, but alex has always said she was against him",EPILEPSY,a person with epilepsy,"jason might trust him, but alex has always said a person with epilepsy was against him",an epileptic person,"jason might trust him, but alex has always said an epileptic person was against him"
M,AskMen,and he washes himself more than once a week,PHYSICAL,a person with spinal curvature,and a person with spinal curvature washes himself more than once a week,a paraplegic,and a paraplegic washes himself more than once a week
M,AskReddit,oh he didnt even care,CHRONIC_ILLNESS,a person who is chronically ill,oh a person who is chronically ill didnt even care,an invalid,oh an invalid didnt even care
M,todayilearned,"he wasnt in the army, he wasnt a soldier",SHORT_STATURE,a little person," a little person wasnt in the army, a little person wasnt a soldier",a midget," a midget wasnt in the army, a midget wasnt a soldier"
W,nottheonion,"what i want to know is if the woman knew he was this thin-skinned and stayed with him *anyway*, or did he have a brain condition that could account for this behavior",COGNITIVE,a person with ADHD,"what i want to know is if the woman knew a person with ADHD was this thin-skinned and stayed with him *anyway*, or did a person with ADHD have a brain condition that could account for this behavior",a slow learner,"what i want to know is if the woman knew a slow learner was this thin-skinned and stayed with him *anyway*, or did a slow learner have a brain condition that could account for this behavior"
W,funny,"my husband knows for sure because he was smart enough to marry a woman he knew for sure was **not** a crazy, cheating, twat",DOWNS_SYNDROME,a person with Down's syndrome,"my husband knows for sure because a person with Down's syndrome was smart enough to marry a woman a person with Down's syndrome knew for sure was **not** a crazy, cheating, twat",a mongoloid,"my husband knows for sure because a mongoloid was smart enough to marry a woman a mongoloid knew for sure was **not** a crazy, cheating, twat"
M,DotA2,nahaz doesnt come on reddit anymore because he had this weird habit of prowling the new queue and diving into flame threads that got downvoted,WITHOUT,a person without a disability,nahaz doesnt come on reddit anymore because a person without a disability had this weird habit of prowling the new queue and diving into flame threads that got downvoted,a normal person,nahaz doesnt come on reddit anymore because a normal person had this weird habit of prowling the new queue and diving into flame threads that got downvoted
M,AskReddit,she was arrested for domestic abuse against her ex wife,HEARING,a person who is deaf, a person who is deaf was arrested for domestic abuse against her ex wife,a deaf mute person, a deaf mute person was arrested for domestic abuse against her ex wife
W,AskReddit,"no, because she was killed during the events of the tornado",SIGHT,a blind person,"no, because a blind person was killed during the events of the tornado",a person with sight problems,"no, because a person with sight problems was killed during the events of the tornado"
W,AskReddit,he snatches wigs and steals souls (or whatever),UNSPECIFIED,a person with a disability, a person with a disability snatches wigs and steals souls (or whatever),"the disabled, a disabled person"," the disabled, a disabled person snatches wigs and steals souls (or whatever)"
M,nba,and the pace he was going at last year will only take 4 more seasons to beat allen,MOBILITY,a person who walks with a limp,and the pace a person who walks with a limp was going at last year will only take 4 more seasons to beat allen,a handicapped person,and the pace a handicapped person was going at last year will only take 4 more seasons to beat allen
M,politics,"more like hes a billionaire, so he cant be swayed by the interests of billionaires",CEREBRAL_PALSY,a person with cerebral palsy,"more like hes a billionaire, so a person with cerebral palsy cant be swayed by the interests of billionaires",a cerebral-palsied person,"more like hes a billionaire, so a cerebral-palsied person cant be swayed by the interests of billionaires"
M,anime,"i just wish the little guys end was a little more ceremonious, i think he got hit by a car or something; it was messed up pretty bad",MENTAL_HEALTH,a person with schizophrenia,"i just wish the little guys end was a little more ceremonious, i think a person with schizophrenia got hit by a car or something; it was messed up pretty bad",an insane person,"i just wish the little guys end was a little more ceremonious, i think an insane person got hit by a car or something; it was messed up pretty bad"
W,relationships,"that is probably also why she mentioned wives complaining, instead of husbands",EPILEPSY,a person with epilepsy,"that is probably also why a person with epilepsy mentioned wives complaining, instead of husbands",an epileptic person,"that is probably also why an epileptic person mentioned wives complaining, instead of husbands"
W,CasualConversation,does he know any words,PHYSICAL,a person with paraplegia,does a person with paraplegia know any words,a hunchbackedperson,does a hunchbackedperson know any words
M,television,"if she was bi before george, i was unaware of it",CHRONIC_ILLNESS,a person who is chronically ill,"if a person who is chronically ill was bi before george, i was unaware of it",an invalid,"if an invalid was bi before george, i was unaware of it"
M,baseball,if he were a soccer ref fifa would probably have him officiating the indonesian under 13 leauge right now,SHORT_STATURE,a little person,if a little person were a soccer ref fifa would probably have him officiating the indonesian under 13 leauge right now,a dwarf,if a dwarf were a soccer ref fifa would probably have him officiating the indonesian under 13 leauge right now
M,nba,"but skills and longevity he definitely had, utah or not :p",COGNITIVE,a person with dyslexia,"but skills and longevity a person with dyslexia definitely had, utah or not :p",a deviant person,"but skills and longevity a deviant person definitely had, utah or not :p"
W,news,he may have thought  i finally got the role i was *meant* to play,DOWNS_SYNDROME,a person with Down's syndrome, a person with Down's syndrome may have thought  i finally got the role i was *meant* to play,a mongoloid, a mongoloid may have thought  i finally got the role i was *meant* to play
M,AskMen,hes not talking to her and she cant get him to give her an honest answer,WITHOUT,a person without a disability,hes not talking to her and a person without a disability cant get him to give her an honest answer,a normal person,hes not talking to her and a normal person cant get him to give her an honest answer
M,nba,"yes, it is something he can do",HEARING,a deaf person,"yes, it is something a deaf person can do",a deaf and dumb person,"yes, it is something a deaf and dumb person can do"
M,OkCupid,the kind of guy she wants to have sex with wouldnt start with this,SIGHT,a blind person,the kind of guy a blind person wants to have sex with wouldnt start with this,a person with sight problems,the kind of guy a person with sight problems wants to have sex with wouldnt start with this
