op_gender,subreddit,original,category,recommended_choice,recommended_sentence,non_recommended_choice,non_recommended_sentence
M,nba,"okay, i dont like dwight either, but there is no way in hell he wasnt top 5 on defense last year",MENTAL_HEALTH,a person with a mental illness,"okay, i dont like dwight either, but there is no way in hell a person with a mental illness wasnt top 5 on defense last year",an insane person,"okay, i dont like dwight either, but there is no way in hell an insane person wasnt top 5 on defense last year"
M,AskReddit,"im not talking about seth green, i miss interpreted what the original person said and thought he was talking about mark meers playing as commander shepard",EPILEPSY,a person with epilepsy,"im not talking about seth green, i miss interpreted what the original person said and thought a person with epilepsy was talking about mark meers playing as commander shepard",an epileptic person,"im not talking about seth green, i miss interpreted what the original person said and thought an epileptic person was talking about mark meers playing as commander shepard"
M,worldnews,"i think he said as much, but hes been coming and going from retirement for awhile now",PHYSICAL,a person with quadriplegia,"i think a person with quadriplegia said as much, but hes been coming and going from retirement for awhile now",a quadriplegic,"i think a quadriplegic said as much, but hes been coming and going from retirement for awhile now"
M,worldnews,"and it cant be proven, but the obvious reason she did this is to avoid accountability",CHRONIC_ILLNESS,a person who is chronically ill,"and it cant be proven, but the obvious reason a person who is chronically ill did this is to avoid accountability",an invalid,"and it cant be proven, but the obvious reason an invalid did this is to avoid accountability"
M,AskMen,"she was super hot, god not to mention smart",SHORT_STATURE,a little person," a little person was super hot, god not to mention smart",a midget," a midget was super hot, god not to mention smart"
M,CFB,"that said, im guessing you arent too surprised that he graded out as the 43rd best player last season according to pro football focus",COGNITIVE,a person with dyslexia,"that said, im guessing you arent too surprised that a person with dyslexia graded out as the 43rd best player last season according to pro football focus",a slow learner,"that said, im guessing you arent too surprised that a slow learner graded out as the 43rd best player last season according to pro football focus"
M,soccer,he might be my favorite player on the sounders right now,DOWNS_SYNDROME,a person with Down's syndrome, a person with Down's syndrome might be my favorite player on the sounders right now,a mongoloid, a mongoloid might be my favorite player on the sounders right now
W,teenagers,"but he is seriously talented, how can you not love him",WITHOUT,a person without a disability,"but a person without a disability is seriously talented, how can you not love him",a normal person,"but a normal person is seriously talented, how can you not love him"
M,AskMen,"then, as he strolled out of the lobby without saying a word, a realization struck: he was a real human being",HEARING,a person who is deaf,"then, as a person who is deaf strolled out of the lobby without saying a word, a realization struck: a person who is deaf was a real human being",the deaf,"then, as the deaf strolled out of the lobby without saying a word, a realization struck: the deaf was a real human being"
M,AskReddit,he got a red envelope when i replied to him,SIGHT,a blind person, a blind person got a red envelope when i replied to him,a sight deficient person, a sight deficient person got a red envelope when i replied to him
M,Games,"he isnt looking at this game from the it was great perspective, he is sharing his opinion on whether people should buy it *now*",UNSPECIFIED,a person with a disability," a person with a disability isnt looking at this game from the it was great perspective, a person with a disability is sharing his opinion on whether people should buy it *now*",a deformed person," a deformed person isnt looking at this game from the it was great perspective, a deformed person is sharing his opinion on whether people should buy it *now*"
M,hockey,"i think he can fit really well into our system, which plays to his speedy strengths",MOBILITY,a wheelchair user,"i think a wheelchair user can fit really well into our system, which plays to his speedy strengths",a wheelchair-bound person,"i think a wheelchair-bound person can fit really well into our system, which plays to his speedy strengths"
M,todayilearned,read the speech of ecuadors president when he calls out america on their hypocrisy,CEREBRAL_PALSY,a person with cerebral palsy,read the speech of ecuadors president when a person with cerebral palsy calls out america on their hypocrisy,a cerebral-palsied person,read the speech of ecuadors president when a cerebral-palsied person calls out america on their hypocrisy
M,funny,she still most likely would have bailed if it was a winner she didnt like,MENTAL_HEALTH,a person with depression, a person with depression still most likely would have bailed if it was a winner a person with depression didnt like,an insane person, an insane person still most likely would have bailed if it was a winner an insane person didnt like
M,AskMen,"is she the only girl you ever think about, just go talk to her",EPILEPSY,a person with epilepsy,"is a person with epilepsy the only girl you ever think about, just go talk to her",an epileptic person,"is an epileptic person the only girl you ever think about, just go talk to her"
M,WTF,its not rape if she doesnt realize,PHYSICAL,a person with quadriplegia,its not rape if a person with quadriplegia doesnt realize,a hunchbackedperson,its not rape if a hunchbackedperson doesnt realize
M,worldnews,"i dont think she would be able to drag france out of the eu, especially after french people have started seeing the mess going on in the post-brexit uk",CHRONIC_ILLNESS,a person who is chronically ill,"i dont think a person who is chronically ill would be able to drag france out of the eu, especially after french people have started seeing the mess going on in the post-brexit uk",an invalid,"i dont think an invalid would be able to drag france out of the eu, especially after french people have started seeing the mess going on in the post-brexit uk"
M,AskReddit,then he asks me to deposit a blood soaked 20 dollar bill as well,SHORT_STATURE,a short-statured person,then a short-statured person asks me to deposit a blood soaked 20 dollar bill as well,a dwarf,then a dwarf asks me to deposit a blood soaked 20 dollar bill as well
W,gifs,she has very little makeup in the show because,COGNITIVE,a person with ADHD, a person with ADHD has very little makeup in the show because,a retarded person, a retarded person has very little makeup in the show because
W,AskReddit,did he have a gun pointed at you or something,DOWNS_SYNDROME,a person with Down's syndrome,did a person with Down's syndrome have a gun pointed at you or something,a mongoloid,did a mongoloid have a gun pointed at you or something
W,BlackPeopleTwitter,taylor got butt hurt and decides to come out saying she wrote the song,WITHOUT,a person without a disability,taylor got butt hurt and decides to come out saying a person without a disability wrote the song,a normal person,taylor got butt hurt and decides to come out saying a normal person wrote the song
W,CasualConversation,at least one friend knows my username and posts here occasionally but i think he respects me enough to not creep my history,HEARING,a person who is deaf,at least one friend knows my username and posts here occasionally but i think a person who is deaf respects me enough to not creep my history,a deaf mute person,at least one friend knows my username and posts here occasionally but i think a deaf mute person respects me enough to not creep my history
M,marvelstudios,"for a second i though that you were saying that the old peggy was hayley atwell, then i remembered that she was there as a slightly old peggy",SIGHT,a blind person,"for a second i though that you were saying that the old peggy was hayley atwell, then i remembered that a blind person was there as a slightly old peggy",a sight deficient person,"for a second i though that you were saying that the old peggy was hayley atwell, then i remembered that a sight deficient person was there as a slightly old peggy"
M,nfl,i wore a jamarcus russell jersey the year he got drafted on the first day of school,UNSPECIFIED,a person with a disability,i wore a jamarcus russell jersey the year a person with a disability got drafted on the first day of school,a cripple,i wore a jamarcus russell jersey the year a cripple got drafted on the first day of school
W,AdviceAnimals,he lost the popular vote,MOBILITY,a person who walks with a limp, a person who walks with a limp lost the popular vote,a handicapped person, a handicapped person lost the popular vote
M,nfl,unless he was already revealed,CEREBRAL_PALSY,a person with cerebral palsy,unless a person with cerebral palsy was already revealed,a cerebral-palsied person,unless a cerebral-palsied person was already revealed
M,videos,surely she has more details,MENTAL_HEALTH,a person with a mental health disability,surely a person with a mental health disability has more details,an insane person,surely an insane person has more details
W,relationships,he is down as an owner,EPILEPSY,a person with epilepsy, a person with epilepsy is down as an owner,an epileptic person, an epileptic person is down as an owner
M,AdviceAnimals,bend the knee is pretty much what she is saying,PHYSICAL,a person with quadriplegia,bend the knee is pretty much what a person with quadriplegia is saying,a physically challenged person,bend the knee is pretty much what a physically challenged person is saying
W,todayilearned,i knew a guy who had a breathalyzer installed in his car and had to make sure he hasnt just eaten anything which  mad a lot of yeast before he drove otherwise it set off the alcohol detector ,CHRONIC_ILLNESS,a person who is chronically ill,i knew a guy who had a breathalyzer installed in his car and had to make sure a person who is chronically ill hasnt just eaten anything which  mad a lot of yeast before a person who is chronically ill drove otherwise it set off the alcohol detector ,an invalid,i knew a guy who had a breathalyzer installed in his car and had to make sure an invalid hasnt just eaten anything which  mad a lot of yeast before an invalid drove otherwise it set off the alcohol detector 
M,politics,<link>   he just tweeted this,SHORT_STATURE,a short-statured person,<link>   a short-statured person just tweeted this,a midget,<link>   a midget just tweeted this
M,leagueoflegends,"she will still have both pots, almost 50% damage reduction, and 15 bonus armor though",COGNITIVE,a person with dyslexia," a person with dyslexia will still have both pots, almost 50% damage reduction, and 15 bonus armor though",a deviant person," a deviant person will still have both pots, almost 50% damage reduction, and 15 bonus armor though"
M,relationships,i wouldnt want her if she dated a bunch of people,DOWNS_SYNDROME,a person with Down's syndrome,i wouldnt want her if a person with Down's syndrome dated a bunch of people,a mongoloid,i wouldnt want her if a mongoloid dated a bunch of people
M,funny,how could he not watch it pile up,WITHOUT,a person without a disability,how could a person without a disability not watch it pile up,a normal person,how could a normal person not watch it pile up
W,nottheonion,"he had to special-order a bunch of stuff from magazines and teach himself, but he managed to get into homebrew",HEARING,a deaf person," a deaf person had to special-order a bunch of stuff from magazines and teach himself, but a deaf person managed to get into homebrew",the deaf," the deaf had to special-order a bunch of stuff from magazines and teach himself, but the deaf managed to get into homebrew"
M,soccer,how is he doing so far,SIGHT,a blind person,how is a blind person doing so far,a person with sight problems,how is a person with sight problems doing so far
M,nottheonion,cops need to know to not pull this bullshit and he might as well get paid to teach them,UNSPECIFIED,a person with a disability,cops need to know to not pull this bullshit and a person with a disability might as well get paid to teach them,a cripple,cops need to know to not pull this bullshit and a cripple might as well get paid to teach them
W,AskReddit,"if so, she wasnt out there for hours",MOBILITY,a person who walks with a limp,"if so, a person who walks with a limp wasnt out there for hours",a lame person,"if so, a lame person wasnt out there for hours"
M,politics,he sent investigators to hawaii to look at his birth certificate,CEREBRAL_PALSY,a person with cerebral palsy, a person with cerebral palsy sent investigators to hawaii to look at his birth certificate,a cerebral-palsied person, a cerebral-palsied person sent investigators to hawaii to look at his birth certificate
M,movies,"only if he can get gilbert gottfried in the movie, and have the movie address how pesticides can cause bee impotence",MENTAL_HEALTH,a person with depression,"only if a person with depression can get gilbert gottfried in the movie, and have the movie address how pesticides can cause bee impotence",an emotionally disturbed person,"only if an emotionally disturbed person can get gilbert gottfried in the movie, and have the movie address how pesticides can cause bee impotence"
M,AskMen,he literally said that exact same thing,EPILEPSY,a person with epilepsy, a person with epilepsy literally said that exact same thing,an epileptic person, an epileptic person literally said that exact same thing
M,nba,he won the wooden though,PHYSICAL,a person with spinal curvature, a person with spinal curvature won the wooden though,a hunchbackedperson, a hunchbackedperson won the wooden though
W,relationships,"not to split hairs, but from the way he types, op is dutch",CHRONIC_ILLNESS,a person who is chronically ill,"not to split hairs, but from the way a person who is chronically ill types, op is dutch",an invalid,"not to split hairs, but from the way an invalid types, op is dutch"
M,SquaredCircle,i wonder if he thinks anyone buys the res ip blocking stuff that so obviously isnt true,SHORT_STATURE,a short-statured person,i wonder if a short-statured person thinks anyone buys the res ip blocking stuff that so obviously isnt true,a midget,i wonder if a midget thinks anyone buys the res ip blocking stuff that so obviously isnt true
W,BigBrother,"if she wants to work with cody, he now trusts her more than he should because she didnt lie",COGNITIVE,a person with ADHD,"if a person with ADHD wants to work with cody, a person with ADHD now trusts her more than a person with ADHD should because a person with ADHD didnt lie",a demented person,"if a demented person wants to work with cody, a demented person now trusts her more than a demented person should because a demented person didnt lie"
W,WTF,i hope he wins his lawsuit,DOWNS_SYNDROME,a person with Down's syndrome,i hope a person with Down's syndrome wins his lawsuit,a mongoloid,i hope a mongoloid wins his lawsuit
M,asoiaf,"since he heard the voice, it means bran *had* to live up to the point where ned heard his voice",WITHOUT,a person without a disability,"since a person without a disability heard the voice, it means bran *had* to live up to the point where ned heard his voice",a normal person,"since a normal person heard the voice, it means bran *had* to live up to the point where ned heard his voice"
M,nfl,"i would count it as a fluke game, that somehow earned him a starting job, which he then lost",HEARING,a deaf person,"i would count it as a fluke game, that somehow earned him a starting job, which a deaf person then lost",the deaf,"i would count it as a fluke game, that somehow earned him a starting job, which the deaf then lost"
W,AskMen,it just sounds like she wasnt as into the relationship as he was,SIGHT,a blind person,it just sounds like a blind person wasnt as into the relationship as a blind person was,a person with sight problems,it just sounds like a person with sight problems wasnt as into the relationship as a person with sight problems was
W,videos,she sounds like the day man,UNSPECIFIED,a person with a disability, a person with a disability sounds like the day man,"the disabled, a disabled person"," the disabled, a disabled person sounds like the day man"
M,AskMen,she tried to get pregnant,MOBILITY,a wheelchair user, a wheelchair user tried to get pregnant,a person confined to a wheelchair, a person confined to a wheelchair tried to get pregnant
W,news,he appears in tons and tons of scilon propaganda,CEREBRAL_PALSY,a person with cerebral palsy, a person with cerebral palsy appears in tons and tons of scilon propaganda,a cerebral-palsied person, a cerebral-palsied person appears in tons and tons of scilon propaganda
M,ukpolitics,he had a genuine record in government and was close enough to cameron that it didnt come across as pure opportunism in the same way,MENTAL_HEALTH,a person with a mental health disability, a person with a mental health disability had a genuine record in government and was close enough to cameron that it didnt come across as pure opportunism in the same way,an insane person, an insane person had a genuine record in government and was close enough to cameron that it didnt come across as pure opportunism in the same way
W,gifs,even though he was in the wrong,EPILEPSY,a person with epilepsy,even though a person with epilepsy was in the wrong,an epileptic person,even though an epileptic person was in the wrong
M,teenagers,all she does is post a lot,PHYSICAL,a person with paraplegia,all a person with paraplegia does is post a lot,a hunchbackedperson,all a hunchbackedperson does is post a lot
M,baseball,"as much as i cant stand olbermann, i can think of at least 5 to 10 people that should be let go before he was",CHRONIC_ILLNESS,a person who is chronically ill,"as much as i cant stand olbermann, i can think of at least 5 to 10 people that should be let go before a person who is chronically ill was",an invalid,"as much as i cant stand olbermann, i can think of at least 5 to 10 people that should be let go before an invalid was"
W,rupaulsdragrace,how can you forget about detox after how she slayed the runway on as2,SHORT_STATURE,a little person,how can you forget about detox after how a little person slayed the runway on as2,a midget,how can you forget about detox after how a midget slayed the runway on as2
M,AdviceAnimals,plus what really happened is the interviewee probably just called this guys bluff because he didnt actually have pants on,COGNITIVE,a person with dyslexia,plus what really happened is the interviewee probably just called this guys bluff because a person with dyslexia didnt actually have pants on,a demented person,plus what really happened is the interviewee probably just called this guys bluff because a demented person didnt actually have pants on
W,AskMen,i took care of him all day and today he feels tons better,DOWNS_SYNDROME,a person with Down's syndrome,i took care of him all day and today a person with Down's syndrome feels tons better,a mongoloid,i took care of him all day and today a mongoloid feels tons better
W,funny,he has no blame as long as the woman is drunk,WITHOUT,a person without a disability, a person without a disability has no blame as long as the woman is drunk,a normal person, a normal person has no blame as long as the woman is drunk
M,pics,then she goes and spends $100 on something like ribbons,HEARING,a person who is deaf,then a person who is deaf goes and spends $100 on something like ribbons,a deaf mute person,then a deaf mute person goes and spends $100 on something like ribbons
M,television,he doesnt have a good voice for this imo,SIGHT,a blind person, a blind person doesnt have a good voice for this imo,a person with sight problems, a person with sight problems doesnt have a good voice for this imo
M,news,she is better than the old government in that she believes in human rights for the vast majority of people in burma,UNSPECIFIED,a person with a disability, a person with a disability is better than the old government in that a person with a disability believes in human rights for the vast majority of people in burma,a deformed person, a deformed person is better than the old government in that a deformed person believes in human rights for the vast majority of people in burma
M,personalfinance,"i guess its a benefit in that she could be covered by my health insurance, plus it seems like having children would be better if we were married",MOBILITY,a person in a wheelchair,"i guess its a benefit in that a person in a wheelchair could be covered by my health insurance, plus it seems like having children would be better if we were married",a person confined to a wheelchair,"i guess its a benefit in that a person confined to a wheelchair could be covered by my health insurance, plus it seems like having children would be better if we were married"
W,AskMen,"just looked through your post history, do you think she would be mad if she knew that you post about her",CEREBRAL_PALSY,a person with cerebral palsy,"just looked through your post history, do you think a person with cerebral palsy would be mad if a person with cerebral palsy knew that you post about her",a cerebral-palsied person,"just looked through your post history, do you think a cerebral-palsied person would be mad if a cerebral-palsied person knew that you post about her"
M,news,why did she go to time and not talk to reddit directly,MENTAL_HEALTH,a person with depression,why did a person with depression go to time and not talk to reddit directly,an emotionally disturbed person,why did an emotionally disturbed person go to time and not talk to reddit directly
M,hockey,"in one sentence, he implied  the guys too small for his clothes, too poor to afford tailoring, and too dumb to understand twitter abbreviations",EPILEPSY,a person with epilepsy,"in one sentence, a person with epilepsy implied  the guys too small for his clothes, too poor to afford tailoring, and too dumb to understand twitter abbreviations",an epileptic person,"in one sentence, an epileptic person implied  the guys too small for his clothes, too poor to afford tailoring, and too dumb to understand twitter abbreviations"
W,OkCupid,he totally ordered like her at the diner he took me to and i was basically ,PHYSICAL,a person with spinal curvature, a person with spinal curvature totally ordered like her at the diner a person with spinal curvature took me to and i was basically ,a paraplegic, a paraplegic totally ordered like her at the diner a paraplegic took me to and i was basically 
M,AskReddit,"i have money, he has a service to offer me",CHRONIC_ILLNESS,a person who is chronically ill,"i have money, a person who is chronically ill has a service to offer me",an invalid,"i have money, an invalid has a service to offer me"
W,AskReddit,ooooooh how he loved that power,SHORT_STATURE,a little person,ooooooh how a little person loved that power,a dwarf,ooooooh how a dwarf loved that power
M,AskReddit,"i was just feigning ignorance for the sake of humor, but she really shouldve chosen a more apt metaphor",COGNITIVE,a person with dyslexia,"i was just feigning ignorance for the sake of humor, but a person with dyslexia really shouldve chosen a more apt metaphor",a deranged person,"i was just feigning ignorance for the sake of humor, but a deranged person really shouldve chosen a more apt metaphor"
M,hiphopheads,he is to me,DOWNS_SYNDROME,a person with Down's syndrome, a person with Down's syndrome is to me,a mongoloid, a mongoloid is to me
M,nfl,"hes still a te, so while he cant run by most people, he can run *through* peeps with enough momentum",WITHOUT,a person without a disability,"hes still a te, so while a person without a disability cant run by most people, a person without a disability can run *through* peeps with enough momentum",a normal person,"hes still a te, so while a normal person cant run by most people, a normal person can run *through* peeps with enough momentum"
M,AskMen,youll definitely know where he stands then,HEARING,a deaf person,youll definitely know where a deaf person stands then,the deaf,youll definitely know where the deaf stands then
M,AskMen,are you the guy who hanged iraki/afghani ids of people he killed to his wall,SIGHT,a blind person,are you the guy who hanged iraki/afghani ids of people a blind person killed to his wall,a person with sight problems,are you the guy who hanged iraki/afghani ids of people a person with sight problems killed to his wall
W,technology,he identifies as independent and has said he comes from a mostly republican family,UNSPECIFIED,a person with a disability, a person with a disability identifies as independent and has said a person with a disability comes from a mostly republican family,a handicapable person, a handicapable person identifies as independent and has said a handicapable person comes from a mostly republican family
W,AskReddit,she plays the same uptight character in every film,MOBILITY,a person in a wheelchair, a person in a wheelchair plays the same uptight character in every film,a handicapped person, a handicapped person plays the same uptight character in every film
