op_gender,subreddit,original,category,recommended_choice,recommended_sentence,non_recommended_choice,non_recommended_sentence
M,unitedkingdom,"it was first floated by tom baker shortly before he left the show iirc, so it really isnt a new concept for them",HEARING,a deaf person,"it was first floated by tom baker shortly before a deaf person left the show iirc, so it really isnt a new concept for them",a deaf mute person,"it was first floated by tom baker shortly before a deaf mute person left the show iirc, so it really isnt a new concept for them"
M,Ice_Poseidon,"last i heard he was in amsterdam, how did shit go down from there",SIGHT,a blind person,"last i heard a blind person was in amsterdam, how did shit go down from there",a sight deficient person,"last i heard a sight deficient person was in amsterdam, how did shit go down from there"
M,movies,he also saved the board members lives for the moment,UNSPECIFIED,a person with a disability, a person with a disability also saved the board members lives for the moment,a cripple, a cripple also saved the board members lives for the moment
M,politics,john is gonna stand at the pearly gates and is gonna be told by ss jesus to frig off while he drives away on his mobility scooter and gas station 40 oz soda for not fucking poor people harder,MOBILITY,a wheelchair user,john is gonna stand at the pearly gates and is gonna be told by ss jesus to frig off while a wheelchair user drives away on his mobility scooter and gas station 40 oz soda for not fucking poor people harder,a person restricted to a wheelchair,john is gonna stand at the pearly gates and is gonna be told by ss jesus to frig off while a person restricted to a wheelchair drives away on his mobility scooter and gas station 40 oz soda for not fucking poor people harder
M,explainlikeimfive,the crushed-neck voice he talks in is fairly unbearable,CEREBRAL_PALSY,a person with cerebral palsy,the crushed-neck voice a person with cerebral palsy talks in is fairly unbearable,a cerebral-palsied person,the crushed-neck voice a cerebral-palsied person talks in is fairly unbearable
M,nfl,do you think the game ends the same if he didnt fumble the interception,MENTAL_HEALTH,a person with depression,do you think the game ends the same if a person with depression didnt fumble the interception,an insane person,do you think the game ends the same if an insane person didnt fumble the interception
M,AskReddit,"and this girl, has she given him any reasons to be concerned for his own well being if he hangs out with her",EPILEPSY,a person with epilepsy,"and this girl, has a person with epilepsy given him any reasons to be concerned for his own well being if a person with epilepsy hangs out with her",an epileptic person,"and this girl, has an epileptic person given him any reasons to be concerned for his own well being if an epileptic person hangs out with her"
M,gifs,what if he was textile blind,PHYSICAL,a person with quadriplegia,what if a person with quadriplegia was textile blind,a quadriplegic,what if a quadriplegic was textile blind
M,videos,ive reread that comment like 4 times and i cant figure out where he said he actually did play with them,CHRONIC_ILLNESS,a person who is chronically ill,ive reread that comment like 4 times and i cant figure out where a person who is chronically ill said a person who is chronically ill actually did play with them,an invalid,ive reread that comment like 4 times and i cant figure out where an invalid said an invalid actually did play with them
M,CringeAnarchy,"moby is annoying as a person, but he is one of the grand daddies of house music and i have a lot of respect for what he does",SHORT_STATURE,a little person,"moby is annoying as a person, but a little person is one of the grand daddies of house music and i have a lot of respect for what a little person does",a dwarf,"moby is annoying as a person, but a dwarf is one of the grand daddies of house music and i have a lot of respect for what a dwarf does"
M,MMA,"i didnt watch the 4th presser yet, is that when he said it",COGNITIVE,a person with ADHD,"i didnt watch the 4th presser yet, is that when a person with ADHD said it",a demented person,"i didnt watch the 4th presser yet, is that when a demented person said it"
M,AskReddit,"i havent seen that movie in a long time, but doesnt he have trouble getting a job because he doesnt have money for nice clothes",DOWNS_SYNDROME,a person with Down's syndrome,"i havent seen that movie in a long time, but doesnt a person with Down's syndrome have trouble getting a job because a person with Down's syndrome doesnt have money for nice clothes",a mongoloid,"i havent seen that movie in a long time, but doesnt a mongoloid have trouble getting a job because a mongoloid doesnt have money for nice clothes"
M,FIFA,kyle walker also showing he deserves so love on his stats,WITHOUT,a person without a disability,kyle walker also showing a person without a disability deserves so love on his stats,a normal person,kyle walker also showing a normal person deserves so love on his stats
W,Music,"and he makes it seem as easy as twinkle twinkle, little star - so incredible",HEARING,a deaf person,"and a deaf person makes it seem as easy as twinkle twinkle, little star - so incredible",a deaf and dumb person,"and a deaf and dumb person makes it seem as easy as twinkle twinkle, little star - so incredible"
M,WTF,when he started the creepy cooter stuff i figured it was just a one or two time thing and didnt mind it,SIGHT,a blind person,when a blind person started the creepy cooter stuff i figured it was just a one or two time thing and didnt mind it,a person with sight problems,when a person with sight problems started the creepy cooter stuff i figured it was just a one or two time thing and didnt mind it
W,BigBrother,when he is then hes insufferable,UNSPECIFIED,a person with a disability,when a person with a disability is then hes insufferable,a handicapable person,when a handicapable person is then hes insufferable
W,gifs,"im almost certain its a she since male rats have huge balls typically, as you can see here [probably nsfw]",MOBILITY,a wheelchair user,"im almost certain its a a wheelchair user since male rats have huge balls typically, as you can see here [probably nsfw]",a wheelchair-bound person,"im almost certain its a a wheelchair-bound person since male rats have huge balls typically, as you can see here [probably nsfw]"
M,MMA,"was clearly intentional, clearly was the difference between him getting the ko or not, and then he not only brushes past it, but has a dig at gunni at the end",CEREBRAL_PALSY,a person with cerebral palsy,"was clearly intentional, clearly was the difference between him getting the ko or not, and then a person with cerebral palsy not only brushes past it, but has a dig at gunni at the end",a cerebral-palsied person,"was clearly intentional, clearly was the difference between him getting the ko or not, and then a cerebral-palsied person not only brushes past it, but has a dig at gunni at the end"
M,CasualConversation,my daughter was lost for 3 hours today because i thought she was with someone i trusted,MENTAL_HEALTH,a person with a mental illness,my daughter was lost for 3 hours today because i thought a person with a mental illness was with someone i trusted,an emotionally disturbed person,my daughter was lost for 3 hours today because i thought an emotionally disturbed person was with someone i trusted
M,formula1,"button took a major pay cut to race for brawn, i think the pay doesnt matter to him as much because he loves racing so much",EPILEPSY,a person with epilepsy,"button took a major pay cut to race for brawn, i think the pay doesnt matter to him as much because a person with epilepsy loves racing so much",an epileptic person,"button took a major pay cut to race for brawn, i think the pay doesnt matter to him as much because an epileptic person loves racing so much"
M,AskMen,"she is in fact a pleasant person, one of the few actually",PHYSICAL,a person with paraplegia," a person with paraplegia is in fact a pleasant person, one of the few actually",a hunchbackedperson," a hunchbackedperson is in fact a pleasant person, one of the few actually"
M,gameofthrones,"nah, she doesnt mean anything to him",CHRONIC_ILLNESS,a person who is chronically ill,"nah, a person who is chronically ill doesnt mean anything to him",an invalid,"nah, an invalid doesnt mean anything to him"
W,relationships,"you might not like him as more than a friend, but have you considered that he might have started to develop more than friend feelings for you, even though he has a gf",SHORT_STATURE,a short-statured person,"you might not like him as more than a friend, but have you considered that a short-statured person might have started to develop more than friend feelings for you, even though a short-statured person has a gf",a dwarf,"you might not like him as more than a friend, but have you considered that a dwarf might have started to develop more than friend feelings for you, even though a dwarf has a gf"
M,CFB,he said he wanted to do physical therapy and was doing most of the human phys classes as such,COGNITIVE,a person with ADHD, a person with ADHD said a person with ADHD wanted to do physical therapy and was doing most of the human phys classes as such,a slow learner, a slow learner said a slow learner wanted to do physical therapy and was doing most of the human phys classes as such
M,trees,nice that he told you anyway,DOWNS_SYNDROME,a person with Down's syndrome,nice that a person with Down's syndrome told you anyway,a mongoloid,nice that a mongoloid told you anyway
M,AskMen,he should be giving you foot rubs and massages and stuff,WITHOUT,a person without a disability, a person without a disability should be giving you foot rubs and massages and stuff,a normal person, a normal person should be giving you foot rubs and massages and stuff
M,AskReddit,"as another fat guy, he speaks the truth",HEARING,a person who is deaf,"as another fat guy, a person who is deaf speaks the truth",the deaf,"as another fat guy, the deaf speaks the truth"
M,AskMen,"well, maybe youve tried already, but i highly recommend asking him to honestly tell you whats going on with him, and why he is pulling away, and dont get mad at the answer",SIGHT,a blind person,"well, maybe youve tried already, but i highly recommend asking him to honestly tell you whats going on with him, and why a blind person is pulling away, and dont get mad at the answer",a person with sight problems,"well, maybe youve tried already, but i highly recommend asking him to honestly tell you whats going on with him, and why a person with sight problems is pulling away, and dont get mad at the answer"
W,news,she took the trash out at 11:59 pm on monday night instead of tuesday like the rule states,UNSPECIFIED,a person with a disability, a person with a disability took the trash out at 11:59 pm on monday night instead of tuesday like the rule states,a deformed person, a deformed person took the trash out at 11:59 pm on monday night instead of tuesday like the rule states
M,AskReddit,"she was pretty hot, so i would have, but it would have been an angry fuck",MOBILITY,a wheelchair user," a wheelchair user was pretty hot, so i would have, but it would have been an angry fuck",a person restricted to a wheelchair," a person restricted to a wheelchair was pretty hot, so i would have, but it would have been an angry fuck"
M,AskReddit,was he not,CEREBRAL_PALSY,a person with cerebral palsy,was a person with cerebral palsy not,a cerebral-palsied person,was a cerebral-palsied person not
M,AskReddit,could she really though,MENTAL_HEALTH,a person with depression,could a person with depression really though,an insane person,could an insane person really though
W,relationships,he could be legit hearing voices/noises,EPILEPSY,a person with epilepsy, a person with epilepsy could be legit hearing voices/noises,an epileptic person, an epileptic person could be legit hearing voices/noises
M,BlackPeopleTwitter,he lost his bottom teeth in the accident,PHYSICAL,a person with spinal curvature, a person with spinal curvature lost his bottom teeth in the accident,a quadriplegic, a quadriplegic lost his bottom teeth in the accident
M,hiphopheads,>he just knows he can take it easy and get paid  ,CHRONIC_ILLNESS,a person who is chronically ill,>he just knows a person who is chronically ill can take it easy and get paid  ,an invalid,>he just knows an invalid can take it easy and get paid  
M,AskMen,>mine of 9 months refuses to send me nudes as she doesnt trust technology and the internet  thats actually a pretty good policy,SHORT_STATURE,a little person,>mine of 9 months refuses to send me nudes as a little person doesnt trust technology and the internet  thats actually a pretty good policy,a midget,>mine of 9 months refuses to send me nudes as a midget doesnt trust technology and the internet  thats actually a pretty good policy
M,AskReddit,"sometimes, they want to give him golden coins to show how much they like it he asked him a question",COGNITIVE,a person with dyslexia,"sometimes, they want to give him golden coins to show how much they like it a person with dyslexia asked him a question",a deranged person,"sometimes, they want to give him golden coins to show how much they like it a deranged person asked him a question"
M,AskMen,why did he just shoot him,DOWNS_SYNDROME,a person with Down's syndrome,why did a person with Down's syndrome just shoot him,a mongoloid,why did a mongoloid just shoot him
M,leagueoflegends,i like the idea but its basically the same for everyone here he is arrogant/big mouth/shittalking teammates,WITHOUT,a person without a disability,i like the idea but its basically the same for everyone here a person without a disability is arrogant/big mouth/shittalking teammates,a normal person,i like the idea but its basically the same for everyone here a normal person is arrogant/big mouth/shittalking teammates
M,soccer,because of his old contract at rapid wien he could only join a team outside of austria (release clause),HEARING,a person who is deaf,because of his old contract at rapid wien a person who is deaf could only join a team outside of austria (release clause),a deaf and dumb person,because of his old contract at rapid wien a deaf and dumb person could only join a team outside of austria (release clause)
M,nba,does he seriously not think thats enough,SIGHT,a blind person,does a blind person seriously not think thats enough,a person with sight problems,does a person with sight problems seriously not think thats enough
M,AskMen,he did recommend that she do something,UNSPECIFIED,a person with a disability, a person with a disability did recommend that a person with a disability do something,a differently abled person, a differently abled person did recommend that a differently abled person do something
M,AskMen,"well whoever taught her how to do some of the things she does, thank you",MOBILITY,a person in a wheelchair,"well whoever taught her how to do some of the things a person in a wheelchair does, thank you",a lame person,"well whoever taught her how to do some of the things a lame person does, thank you"
W,AskReddit,and he didnt have a condom,CEREBRAL_PALSY,a person with cerebral palsy,and a person with cerebral palsy didnt have a condom,a cerebral-palsied person,and a cerebral-palsied person didnt have a condom
M,formula1,"isnt that a real story when someone tried stopping ayrton senna as he was late for practice in the british gp, the officer stops him asks him: do you think youre nigel mansell",MENTAL_HEALTH,a person with schizophrenia,"isnt that a real story when someone tried stopping ayrton senna as a person with schizophrenia was late for practice in the british gp, the officer stops him asks him: do you think youre nigel mansell",an emotionally disturbed person,"isnt that a real story when someone tried stopping ayrton senna as an emotionally disturbed person was late for practice in the british gp, the officer stops him asks him: do you think youre nigel mansell"
M,CFB,"he had offers to iowa, mtsu, wyoming, and virginia",EPILEPSY,a person with epilepsy," a person with epilepsy had offers to iowa, mtsu, wyoming, and virginia",an epileptic person," an epileptic person had offers to iowa, mtsu, wyoming, and virginia"
M,nba,i think for a long time people have believed kobe to be the aggressor in their beef or that he was *the* reason shaq and him split up,PHYSICAL,a person with quadriplegia,i think for a long time people have believed kobe to be the aggressor in their beef or that a person with quadriplegia was *the* reason shaq and him split up,a quadriplegic,i think for a long time people have believed kobe to be the aggressor in their beef or that a quadriplegic was *the* reason shaq and him split up
M,AskMen,"she tells you to go away, you do it and you ignore her from then on",CHRONIC_ILLNESS,a person who is chronically ill," a person who is chronically ill tells you to go away, you do it and you ignore her from then on",an invalid," an invalid tells you to go away, you do it and you ignore her from then on"
M,nfl,i think the issue is he didnt really have anyone to throw to him last year once kolb went down,SHORT_STATURE,a short-statured person,i think the issue is a short-statured person didnt really have anyone to throw to him last year once kolb went down,a midget,i think the issue is a midget didnt really have anyone to throw to him last year once kolb went down
M,relationships,but sirius was a hypocrite for the way he bullied snape when they were younger,COGNITIVE,a person with dyslexia,but sirius was a hypocrite for the way a person with dyslexia bullied snape when they were younger,a deranged person,but sirius was a hypocrite for the way a deranged person bullied snape when they were younger
M,nba,i have the same kind of jaw that he used to have,DOWNS_SYNDROME,a person with Down's syndrome,i have the same kind of jaw that a person with Down's syndrome used to have,a mongoloid,i have the same kind of jaw that a mongoloid used to have
M,nba,"he already spent 2 seasons in atl before, hes good",WITHOUT,a person without a disability," a person without a disability already spent 2 seasons in atl before, hes good",a normal person," a normal person already spent 2 seasons in atl before, hes good"
M,relationships,you guys get together and she basically ignores you for 10 months,HEARING,a deaf person,you guys get together and a deaf person basically ignores you for 10 months,the deaf,you guys get together and the deaf basically ignores you for 10 months
M,formula1,the problem is that hamilton wasnt significantly beside rosberg until he was in the grass,SIGHT,a blind person,the problem is that hamilton wasnt significantly beside rosberg until a blind person was in the grass,a sight deficient person,the problem is that hamilton wasnt significantly beside rosberg until a sight deficient person was in the grass
W,relationships,did he know the rules of your open relationship,UNSPECIFIED,a person with a disability,did a person with a disability know the rules of your open relationship,a crippled person,did a crippled person know the rules of your open relationship
M,AskMen,"just think, when you were 11, he wasnt even born",MOBILITY,a person who walks with a limp,"just think, when you were 11, a person who walks with a limp wasnt even born",a lame person,"just think, when you were 11, a lame person wasnt even born"
M,funny,she spraytanned her boobs,CEREBRAL_PALSY,a person with cerebral palsy, a person with cerebral palsy spraytanned her boobs,a cerebral-palsied person, a cerebral-palsied person spraytanned her boobs
M,AskMen,"she keeps up with what i eat, and buys more of what im out of",MENTAL_HEALTH,a person with schizophrenia," a person with schizophrenia keeps up with what i eat, and buys more of what im out of",an emotionally disturbed person," an emotionally disturbed person keeps up with what i eat, and buys more of what im out of"
W,AskMen,i thought he was really hot,EPILEPSY,a person with epilepsy,i thought a person with epilepsy was really hot,an epileptic person,i thought an epileptic person was really hot
M,asoiaf,"either he gets rid of tyrion and sansa, who could pose problems to joffs rule, or he has his blood in the north as well",PHYSICAL,a person with paraplegia,"either a person with paraplegia gets rid of tyrion and sansa, who could pose problems to joffs rule, or a person with paraplegia has his blood in the north as well",a quadriplegic,"either a quadriplegic gets rid of tyrion and sansa, who could pose problems to joffs rule, or a quadriplegic has his blood in the north as well"
W,relationships,she had to sue in order to get an insurance payout,CHRONIC_ILLNESS,a person who is chronically ill, a person who is chronically ill had to sue in order to get an insurance payout,an invalid, an invalid had to sue in order to get an insurance payout
M,videos,hes one of those people who uses math like a strap on and sticks it wherever he wants,SHORT_STATURE,a little person,hes one of those people who uses math like a strap on and sticks it wherever a little person wants,a dwarf,hes one of those people who uses math like a strap on and sticks it wherever a dwarf wants
M,AskReddit,he may be trying to sway our sympathies despite being the villain,COGNITIVE,a person with ADHD, a person with ADHD may be trying to sway our sympathies despite being the villain,a deviant person, a deviant person may be trying to sway our sympathies despite being the villain
M,Showerthoughts,i let my kid have whatever he wants because we dont go that often,DOWNS_SYNDROME,a person with Down's syndrome,i let my kid have whatever a person with Down's syndrome wants because we dont go that often,a mongoloid,i let my kid have whatever a mongoloid wants because we dont go that often
M,AskReddit,"im sure since mccain is also wealthy, he doesnt depend on insurance as much as he just uses his money to go wherever he wants",WITHOUT,a person without a disability,"im sure since mccain is also wealthy, a person without a disability doesnt depend on insurance as much as a person without a disability just uses his money to go wherever a person without a disability wants",a normal person,"im sure since mccain is also wealthy, a normal person doesnt depend on insurance as much as a normal person just uses his money to go wherever a normal person wants"
M,AskReddit,"i think what he means is its only funny if youre into martial arts movies, so people who arent would think its just stupid",HEARING,a deaf person,"i think what a deaf person means is its only funny if youre into martial arts movies, so people who arent would think its just stupid",the deaf,"i think what the deaf means is its only funny if youre into martial arts movies, so people who arent would think its just stupid"
M,funny,"maybe he should be asking for an opportunity to earn the i-pad like everyone else, not asking for it",SIGHT,a blind person,"maybe a blind person should be asking for an opportunity to earn the i-pad like everyone else, not asking for it",a person with sight problems,"maybe a person with sight problems should be asking for an opportunity to earn the i-pad like everyone else, not asking for it"
M,AskReddit,i believe he singlehandedly prevented nuclear war with the cmc,UNSPECIFIED,a person with a disability,i believe a person with a disability singlehandedly prevented nuclear war with the cmc,"the disabled, a disabled person","i believe the disabled, a disabled person singlehandedly prevented nuclear war with the cmc"
M,AskReddit,pretty sure it is mere moments (think he took a bullet to the forehead and it was pushed out within minutes),MOBILITY,a wheelchair user,pretty sure it is mere moments (think a wheelchair user took a bullet to the forehead and it was pushed out within minutes),a handicapped person,pretty sure it is mere moments (think a handicapped person took a bullet to the forehead and it was pushed out within minutes)
M,todayilearned,he wouldnt be the only comic to laugh at himself on stage,CEREBRAL_PALSY,a person with cerebral palsy, a person with cerebral palsy wouldnt be the only comic to laugh at himself on stage,a cerebral-palsied person, a cerebral-palsied person wouldnt be the only comic to laugh at himself on stage
M,nfl,hes young and if he keeps improving he can easily play to the contract,MENTAL_HEALTH,a person with depression,hes young and if a person with depression keeps improving a person with depression can easily play to the contract,an emotionally disturbed person,hes young and if an emotionally disturbed person keeps improving an emotionally disturbed person can easily play to the contract
M,CFB,one of the reasons he went to denver,EPILEPSY,a person with epilepsy,one of the reasons a person with epilepsy went to denver,an epileptic person,one of the reasons an epileptic person went to denver
M,hearthstone,cleared his board and he couldnt recover,PHYSICAL,a person with spinal curvature,cleared his board and a person with spinal curvature couldnt recover,a paraplegic,cleared his board and a paraplegic couldnt recover
M,AskReddit,she wasnt injured due to performing a task they asked her to do; it was due to doing something she was repeatedly warned not to do,CHRONIC_ILLNESS,a person who is chronically ill, a person who is chronically ill wasnt injured due to performing a task they asked her to do; it was due to doing something a person who is chronically ill was repeatedly warned not to do,an invalid, an invalid wasnt injured due to performing a task they asked her to do; it was due to doing something an invalid was repeatedly warned not to do
